{
  "protocol_version": 1,
  "host_id": "fixture-host",
  "boot_id": "fixture-boot",
  "steam_bridge": "unavailable",
  "steam_reason": "Decky frontend bridge has not reported readiness",
  "uptime_seconds": 812,
  "cpu_temperature": null,
  "capabilities": {
    "suspend": "unavailable",
    "restart": "unverified",
    "shutdown": "unverified",
    "display_rescue": "unavailable",
    "sunshine_restart": "disabled"
  },
  "sunshine": {
    "enabled": false,
    "provider": null,
    "state": "disabled",
    "checked_at": null,
    "age_ms": null,
    "stale": false,
    "reason": null,
    "operation_id": null
  }
}
